      "\u001b[32m[I 2023-02-17 10:38:28,018]\u001b[0m Trial 89 finished with value: 8.220082149469668 and parameters: {'C': 0.15565170050074784, 'penalty': 'l1', 'fit_intercept': True}. Best is trial 62 with value: 8.198328832293907.\u001b[0m\n",
      "\u001b[32m[I 2023-02-17 10:38:28,294]\u001b[0m Trial 90 finished with value: 8.215248228194367 and parameters: {'C': 0.7506376168835345, 'penalty': 'l1', 'fit_intercept': True}. Best is trial 62 with value: 8.198328832293907.\u001b[0m\n",
      "\u001b[32m[I 2023-02-17 10:38:28,558]\u001b[0m Trial 92 finished with value: 8.249083774716894 and parameters: {'C': 0.5051732837836762, 'penalty': 'none', 'fit_intercept': True}. Best is trial 62 with value: 8.198328832293907.\u001b[0m\n",
      "\u001b[32m[I 2023-02-17 10:38:28,952]\u001b[0m Trial 91 finished with value: 8.21041427894253 and parameters: {'C': 0.8065457520463032, 'penalty': 'l1', 'fit_intercept': True}. Best is trial 62 with value: 8.198328832293907.\u001b[0m\n",
      "\u001b[32m[I 2023-02-17 10:38:29,007]\u001b[0m Trial 94 finished with value: 8.246667709328458 and parameters: {'C': 0.560374893711422, 'penalty': 'l1', 'fit_intercept': True}. Best is trial 62 with value: 8.198328832293907.\u001b[0m\n",
      "\u001b[32m[I 2023-02-17 10:38:29,057]\u001b[0m Trial 93 finished with value: 8.204371205911494 and parameters: {'C': 0.8065457520463032, 'penalty': 'none', 'fit_intercept': True}. Best is trial 62 with value: 8.198328832293907.\u001b[0m\n",
      "\u001b[32m[I 2023-02-17 10:38:29,665]\u001b[0m Trial 98 finished with value: 8.250292338965332 and parameters: {'C': 0.7337233638654149, 'penalty': 'none', 'fit_intercept': True}. Best is trial 62 with value: 8.198328832293907.\u001b[0m\n",
      "\u001b[32m[I 2023-02-17 10:38:30,198]\u001b[0m Trial 97 finished with value: 8.21283126755672 and parameters: {'C': 0.8412756142236871, 'penalty': 'l1', 'fit_intercept': True}. Best is trial 62 with value: 8.198328832293907.\u001b[0m\n",
      "\u001b[32m[I 2023-02-17 10:38:30,235]\u001b[0m Trial 96 finished with value: 8.211622815214431 and parameters: {'C': 0.562054482682929, 'penalty': 'l1', 'fit_intercept': True}. Best is trial 62 with value: 8.198328832293907.\u001b[0m\n",
      "\u001b[32m[I 2023-02-17 10:38:30,414]\u001b[0m Trial 95 finished with value: 8.216456652560117 and parameters: {'C': 0.5851560435116105, 'penalty': 'l1', 'fit_intercept': True}. Best is trial 62 with value: 8.198328832293907.\u001b[0m\n",
      "\u001b[32m[I 2023-02-17 10:38:30,716]\u001b[0m Trial 99 finished with value: 8.21283031635443 and parameters: {'C': 1.0461855157044002, 'penalty': 'none', 'fit_intercept': True}. Best is trial 62 with value: 8.198328832293907.\u001b[0m\n",
      "\u001b[32m[I 2023-02-17 10:38:30,837]\u001b[0m Trial 102 finished with value: 8.244249853441593 and parameters: {'C': 1.1835595334965499, 'penalty': 'none', 'fit_intercept': True}. Best is trial 62 with value: 8.198328832293907.\u001b[0m\n",
      "\u001b[32m[I 2023-02-17 10:38:30,837]\u001b[0m Trial 101 finished with value: 8.216455617428215 and parameters: {'C': 1.0461855157044002, 'penalty': 'none', 'fit_intercept': True}. Best is trial 62 with value: 8.198328832293907.\u001b[0m\n",
      "\u001b[32m[I 2023-02-17 10:38:31,278]\u001b[0m Trial 103 finished with value: 8.222497655327349 and parameters: {'C': 1.4806853519511822, 'penalty': 'none', 'fit_intercept': True}. Best is trial 62 with value: 8.198328832293907.\u001b[0m\n",
      "\u001b[32m[I 2023-02-17 10:38:31,285]\u001b[0m Trial 100 finished with value: 8.212830260401352 and parameters: {'C': 1.0867788142619192, 'penalty': 'none', 'fit_intercept': True}. Best is trial 62 with value: 8.198328832293907.\u001b[0m\n",
      "\u001b[32m[I 2023-02-17 10:38:31,549]\u001b[0m Trial 105 finished with value: 8.22733194029764 and parameters: {'C': 0.3745168254537794, 'penalty': 'none', 'fit_intercept': True}. Best is trial 62 with value: 8.198328832293907.\u001b[0m\n",
      "\u001b[32m[I 2023-02-17 10:38:31,652]\u001b[0m Trial 106 finished with value: 8.250292338965332 and parameters: {'C': 0.4276855478215523, 'penalty': 'l2', 'fit_intercept': True}. Best is trial 62 with value: 8.198328832293907.\u001b[0m\n",
      "\u001b[32m[I 2023-02-17 10:38:32,137]\u001b[0m Trial 107 finished with value: 8.207996590914894 and parameters: {'C': 0.385747857973403, 'penalty': 'l2', 'fit_intercept': True}. Best is trial 62 with value: 8.198328832293907.\u001b[0m\n",
      "\u001b[32m[I 2023-02-17 10:38:32,157]\u001b[0m Trial 104 finished with value: 8.216455701357829 and parameters: {'C': 1.4996076633665074, 'penalty': 'none', 'fit_intercept': True}. Best is trial 62 with value: 8.198328832293907.\u001b[0m\n",
      "\u001b[32m[I 2023-02-17 10:38:32,288]\u001b[0m Trial 108 finished with value: 8.23216533001872 and parameters: {'C': 0.43235250787942997, 'penalty': 'l2', 'fit_intercept': True}. Best is trial 62 with value: 8.198328832293907.\u001b[0m\n",
      "\u001b[32m[I 2023-02-17 10:38:32,990]\u001b[0m Trial 109 finished with value: 8.215248256170906 and parameters: {'C': 0.7633220953391018, 'penalty': 'l1', 'fit_intercept': True}. Best is trial 62 with value: 8.198328832293907.\u001b[0m\n",
      "\u001b[32m[I 2023-02-17 10:38:33,010]\u001b[0m Trial 112 finished with value: 8.233373950220235 and parameters: {'C': 0.6895329552551867, 'penalty': 'l2', 'fit_intercept': True}. Best is trial 62 with value: 8.198328832293907.\u001b[0m\n",
      "\u001b[32m[I 2023-02-17 10:38:33,280]\u001b[0m Trial 110 finished with value: 8.214038656790564 and parameters: {'C': 0.7956169312610232, 'penalty': 'l2', 'fit_intercept': True}. Best is trial 62 with value: 8.198328832293907.\u001b[0m\n",
      "\u001b[32m[I 2023-02-17 10:38:33,317]\u001b[0m Trial 113 finished with value: 8.238207507800542 and parameters: {'C': 0.6334264079574883, 'penalty': 'l2', 'fit_intercept': True}. Best is trial 62 with value: 8.198328832293907.\u001b[0m\n",
      "\u001b[32m[I 2023-02-17 10:38:33,560]\u001b[0m Trial 111 finished with value: 8.210413439646391 and parameters: {'C': 0.8065508826459779, 'penalty': 'l2', 'fit_intercept': True}. Best is trial 62 with value: 8.198328832293907.\u001b[0m\n",
      "\u001b[32m[I 2023-02-17 10:38:33,755]\u001b[0m Trial 116 finished with value: 8.255126232264095 and parameters: {'C': 0.2513108574682647, 'penalty': 'l2', 'fit_intercept': True}. Best is trial 62 with value: 8.198328832293907.\u001b[0m\n",
      "\u001b[32m[I 2023-02-17 10:38:33,837]\u001b[0m Trial 115 finished with value: 8.26237680643513 and parameters: {'C': 0.22712407979701488, 'penalty': 'l2', 'fit_intercept': True}. Best is trial 62 with value: 8.198328832293907.\u001b[0m\n",
      "\u001b[32m[I 2023-02-17 10:38:33,850]\u001b[0m Trial 114 finished with value: 8.215247249015542 and parameters: {'C': 0.2585858272339558, 'penalty': 'l2', 'fit_intercept': True}. Best is trial 62 with value: 8.198328832293907.\u001b[0m\n",
      "\u001b[32m[I 2023-02-17 10:38:34,373]\u001b[0m Trial 117 finished with value: 8.210413187857553 and parameters: {'C': 0.4718385150774379, 'penalty': 'l2', 'fit_intercept': True}. Best is trial 62 with value: 8.198328832293907.\u001b[0m\n",
      "\u001b[32m[I 2023-02-17 10:38:34,413]\u001b[0m Trial 120 finished with value: 8.246666786102704 and parameters: {'C': 0.37448244554979354, 'penalty': 'l2', 'fit_intercept': True}. Best is trial 62 with value: 8.198328832293907.\u001b[0m\n",
      "\u001b[32m[I 2023-02-17 10:38:34,548]\u001b[0m Trial 119 finished with value: 8.230956905652974 and parameters: {'C': 0.4900985680950606, 'penalty': 'l2', 'fit_intercept': True}. Best is trial 62 with value: 8.198328832293907.\u001b[0m\n",
      "\u001b[32m[I 2023-02-17 10:38:34,730]\u001b[0m Trial 122 finished with value: 8.246666786102704 and parameters: {'C': 0.49870893747744915, 'penalty': 'l2', 'fit_intercept': False}. Best is trial 62 with value: 8.198328832293907.\u001b[0m\n",
      "\u001b[32m[I 2023-02-17 10:38:34,824]\u001b[0m Trial 121 finished with value: 8.255126092381406 and parameters: {'C': 0.49284965645764406, 'penalty': 'l2', 'fit_intercept': False}. Best is trial 62 with value: 8.198328832293907.\u001b[0m\n",
      "\u001b[32m[I 2023-02-17 10:38:34,895]\u001b[0m Trial 118 finished with value: 8.21524727699208 and parameters: {'C': 0.4832324710781941, 'penalty': 'l2', 'fit_intercept': True}. Best is trial 62 with value: 8.198328832293907.\u001b[0m\n",
      "\u001b[32m[I 2023-02-17 10:38:35,010]\u001b[0m Trial 123 finished with value: 8.252709131743755 and parameters: {'C': 0.49547914281942596, 'penalty': 'l2', 'fit_intercept': False}. Best is trial 62 with value: 8.198328832293907.\u001b[0m\n",
      "\u001b[32m[I 2023-02-17 10:38:35,307]\u001b[0m Trial 124 finished with value: 8.249083942576123 and parameters: {'C': 0.8573213288225163, 'penalty': 'l2', 'fit_intercept': True}. Best is trial 62 with value: 8.198328832293907.\u001b[0m\n",
      "\u001b[32m[I 2023-02-17 10:38:35,358]\u001b[0m Trial 125 finished with value: 8.25029236694187 and parameters: {'C': 0.9150325602275309, 'penalty': 'l2', 'fit_intercept': True}. Best is trial 62 with value: 8.198328832293907.\u001b[0m\n",
      "\u001b[32m[I 2023-02-17 10:38:35,399]\u001b[0m Trial 126 finished with value: 8.251500875237234 and parameters: {'C': 0.8573213288225163, 'penalty': 'l2', 'fit_intercept': True}. Best is trial 62 with value: 8.198328832293907.\u001b[0m\n",
      "\u001b[32m[I 2023-02-17 10:38:35,892]\u001b[0m Trial 129 finished with value: 8.247875518210373 and parameters: {'C': 0.6422634169492649, 'penalty': 'l2', 'fit_intercept': True}. Best is trial 62 with value: 8.198328832293907.\u001b[0m\n",
      "\u001b[32m[I 2023-02-17 10:38:35,906]\u001b[0m Trial 127 finished with value: 8.211621696152916 and parameters: {'C': 0.9044711611615769, 'penalty': 'l2', 'fit_intercept': True}. Best is trial 62 with value: 8.198328832293907.\u001b[0m\n",
      "\u001b[32m[I 2023-02-17 10:38:35,921]\u001b[0m Trial 128 finished with value: 8.252709243649907 and parameters: {'C': 0.35612096813530547, 'penalty': 'l2', 'fit_intercept': True}. Best is trial 62 with value: 8.198328832293907.\u001b[0m\n",
      "\u001b[32m[I 2023-02-17 10:38:36,336]\u001b[0m Trial 131 finished with value: 8.247875518210373 and parameters: {'C': 0.6348982306281373, 'penalty': 'l2', 'fit_intercept': True}. Best is trial 62 with value: 8.198328832293907.\u001b[0m\n",
      "\u001b[32m[I 2023-02-17 10:38:37,029]\u001b[0m Trial 132 finished with value: 8.216455645404753 and parameters: {'C': 0.3879975753305631, 'penalty': 'l2', 'fit_intercept': True}. Best is trial 62 with value: 8.198328832293907.\u001b[0m\n",
      "\u001b[32m[I 2023-02-17 10:38:37,137]\u001b[0m Trial 130 finished with value: 8.205579658253782 and parameters: {'C': 1.7492428217117773, 'penalty': 'l2', 'fit_intercept': True}. Best is trial 62 with value: 8.198328832293907.\u001b[0m\n",
      "\u001b[32m[I 2023-02-17 10:38:37,497]\u001b[0m Trial 133 finished with value: 8.209205155163334 and parameters: {'C': 0.38584940993610345, 'penalty': 'l2', 'fit_intercept': True}. Best is trial 62 with value: 8.198328832293907.\u001b[0m\n",
      "\u001b[32m[I 2023-02-17 10:38:37,966]\u001b[0m Trial 134 finished with value: 8.216455393615911 and parameters: {'C': 1.270310588632334, 'penalty': 'l2', 'fit_intercept': True}. Best is trial 62 with value: 8.198328832293907.\u001b[0m\n",
      "\u001b[32m[I 2023-02-17 10:38:38,063]\u001b[0m Trial 136 finished with value: 8.244249993324283 and parameters: {'C': 1.6903129048405776, 'penalty': 'l2', 'fit_intercept': True}. Best is trial 62 with value: 8.198328832293907.\u001b[0m\n",
      "\u001b[32m[I 2023-02-17 10:38:38,308]\u001b[0m Trial 135 finished with value: 8.210413355716778 and parameters: {'C': 1.743501860802611, 'penalty': 'l2', 'fit_intercept': True}. Best is trial 62 with value: 8.198328832293907.\u001b[0m\n",
      "\u001b[32m[I 2023-02-17 10:38:38,530]\u001b[0m Trial 138 finished with value: 8.251500903213772 and parameters: {'C': 1.7228365993625243, 'penalty': 'l2', 'fit_intercept': True}. Best is trial 62 with value: 8.198328832293907.\u001b[0m\n",
      "\u001b[32m[I 2023-02-17 10:38:39,186]\u001b[0m Trial 139 finished with value: 8.244250049277358 and parameters: {'C': 2.004047082657374, 'penalty': 'l2', 'fit_intercept': True}. Best is trial 62 with value: 8.198328832293907.\u001b[0m\n",
      "\u001b[32m[I 2023-02-17 10:38:39,847]\u001b[0m Trial 137 finished with value: 8.211622003894833 and parameters: {'C': 1.6881329891557173, 'penalty': 'l2', 'fit_intercept': True}. Best is trial 62 with value: 8.198328832293907.\u001b[0m\n",
      "\u001b[32m[I 2023-02-17 10:38:41,105]\u001b[0m Trial 140 finished with value: 8.209204903374491 and parameters: {'C': 0.32273955285610206, 'penalty': 'l2', 'fit_intercept': True}. Best is trial 62 with value: 8.198328832293907.\u001b[0m\n",
      "\u001b[32m[I 2023-02-17 10:38:41,614]\u001b[0m Trial 141 finished with value: 8.247875574163448 and parameters: {'C': 0.32068692350825667, 'penalty': 'l2', 'fit_intercept': True}. Best is trial 62 with value: 8.198328832293907.\u001b[0m\n",
      "\u001b[32m[I 2023-02-17 10:38:42,102]\u001b[0m Trial 142 finished with value: 8.238207479824005 and parameters: {'C': 0.22677737647344867, 'penalty': 'l2', 'fit_intercept': True}. Best is trial 62 with value: 8.198328832293907.\u001b[0m\n",
      "\u001b[32m[I 2023-02-17 10:38:42,744]\u001b[0m Trial 143 finished with value: 8.221289175008522 and parameters: {'C': 0.33183468485179807, 'penalty': 'l2', 'fit_intercept': True}. Best is trial 62 with value: 8.198328832293907.\u001b[0m\n",
      "\u001b[32m[I 2023-02-17 10:38:43,434]\u001b[0m Trial 144 finished with value: 8.246666953961933 and parameters: {'C': 0.1648049730677063, 'penalty': 'l2', 'fit_intercept': True}. Best is trial 62 with value: 8.198328832293907.\u001b[0m\n",
      "\u001b[32m[I 2023-02-17 10:38:44,646]\u001b[0m Trial 145 finished with value: 8.216455393615913 and parameters: {'C': 0.3859354935049987, 'penalty': 'l2', 'fit_intercept': True}. Best is trial 62 with value: 8.198328832293907.\u001b[0m\n",
      "\u001b[32m[I 2023-02-17 10:38:45,849]\u001b[0m Trial 146 finished with value: 8.207996451032203 and parameters: {'C': 0.2871110323573213, 'penalty': 'l2', 'fit_intercept': True}. Best is trial 62 with value: 8.198328832293907.\u001b[0m\n"
     ]
    },
    {
     "name": "stdout",
     "output_type": "stream",
     "text": [
      "Best params: {'C': 0.46570264632805103, 'penalty': 'none', 'fit_intercept': True}\n",
      "Number of finished trials:  148\n"
     ]
    },
    {
     "name": "stderr",
     "output_type": "stream",
     "text": [
      "\u001b[32m[I 2023-02-17 10:38:46,575]\u001b[0m Trial 147 finished with value: 8.249083886623046 and parameters: {'C': 0.2843200519404071, 'penalty': 'l2', 'fit_intercept': True}. Best is trial 62 with value: 8.198328832293907.\u001b[0m\n"
     ]
    }
   ],
   "source": [
    "storage = optuna.integration.DaskStorage()\n",
    "study = optuna.create_study(\n",
    "    sampler=optuna.samplers.TPESampler(seed=142),\n",
    "    study_name=study_name,\n",
    "    direction=\"minimize\",\n",
    "    storage=storage,\n",
    ")\n",
    "# Optimize in parallel on your Dask cluster\n",
    "#\n",
    "# Submit `n_workers` optimization tasks, where each task runs about 40 optimization trials\n",
    "# for a total of about N_TRIALS trials in all\n",
    "futures = [\n",
    "    c.submit(\n",
    "        study.optimize,\n",
    "        lambda trial: objective(trial, X, y),\n",
    "        n_trials=N_TRIALS // n_workers,\n",
    "        pure=False,\n",
    "    )\n",
    "    for _ in range(n_workers)\n",
    "]\n",
    "wait(futures)\n",
    "print(f\"Best params: {study.best_params}\")\n",
    "\n",
    "print(\"Number of finished trials: \", len(study.trials))"
   ]
  },
  {
   "cell_type": "markdown",
   "metadata": {},
   "source": [
    "## Visualization\n",
    "\n",
    "Optuna provides an easy way to visualize the trials via builtin graphs. Read more about visualizations [here](https://optuna.readthedocs.io/en/stable/tutorial/10_key_features/005_visualization.html)."
   ]
  },
  {
   "cell_type": "markdown",
   "metadata": {},
   "source": [
    "## Conluding Remarks\n",
    " \n",
    "This notebook shows how RAPIDS and Optuna can be used along with dask to run multi-GPU HPO jobs, and can be used as a starting point for anyone wanting to get started with the framework. We have seen how by just adding a few lines of code we were able to integrate the libraries for a muli-GPU HPO runs. This can also be scaled to multiple nodes.\n",
    " \n",
    "## Next Steps\n",
    " \n",
    "This is done on a small dataset, you are encouraged to test out on larger data with more range for the parameters too. These experiments can yield performance improvements. Refer to other examples in the [rapidsai/cloud-ml-examples](https://github.com/rapidsai/cloud-ml-examples) repository.\n",
    " \n",
    "## Resources\n",
    "[Hyperparameter Tuning in Python](https://towardsdatascience.com/hyperparameter-tuning-c5619e7e6624)\n",
    "\n",
    "[Overview of Hyperparameter tuning](https://cloud.google.com/ai-platform/training/docs/hyperparameter-tuning-overview)\n",
    "\n",
    "[How to make your model awesome with Optuna](https://towardsdatascience.com/how-to-make-your-model-awesome-with-optuna-b56d490368af)"
   ]
  }
 ],
 "metadata": {
  "kernelspec": {
   "display_name": "Python 3 (ipykernel)",
   "language": "python",
   "name": "python3"
  },
  "language_info": {
   "codemirror_mode": {
    "name": "ipython",
    "version": 3
   },
   "file_extension": ".py",
   "mimetype": "text/x-python",
   "name": "python",
   "nbconvert_exporter": "python",
   "pygments_lexer": "ipython3",
   "version": "3.10.9"
  }
 },
 "nbformat": 4,
 "nbformat_minor": 4
}
