{
 "cells": [
  {
   "cell_type": "markdown",
   "metadata": {
    "tags": [
     "library/optuna",
     "library/dask",
     "workflow/hpo",
     "library/cuml",
     "library/numpy",
     "dataset/bnp-claims"
    ]
   },
   "source": [
    "# Getting Started with Optuna and RAPIDS for HPO\n",
    "Hyperparameter optimization (HPO) automates the process of picking values for the hyperparameters of a machine learning algorithm to improve model performance. This can help boost the model accuracy, but can be resource-intensive, as it may require training the model for hundreds of hyperparameter combinations. Let's take a look at how we can use Optuna and RAPIDS to make HPO less time-consuming.\n",
    "\n",
    "## RAPIDS\n",
    "The RAPIDS framework provides a suite of libraries to execute end-to-end data science pipelines entirely on GPUs. One of the libraries in this framework is cuML, which implements common machine learning models with a scikit-learn-compatible API and a GPU-accelerated backend. You can learn more about RAPIDS [here](https://rapids.ai/about.html).\n",
    "\n",
    "## Optuna\n",
    "[Optuna](https://optuna.readthedocs.io/en/stable/) is a lightweight framework for automatic hyperparameter optimization. It provides a define-by-run API, which makes it easy to adapt to any already existing code that we have and enables high modularity along with the flexibility to construct hyperparameter spaces dynamically. By simply wrapping the objective function with Optuna, we can perform a parallel-distributed HPO search over a search space as we'll see in this notebook.\n",
    "\n",
    "\n",
    "In this notebook, we'll use BNP Paribas Cardif Claims Management dataset from Kaggle to predict if a claim will receive accelerated approval or not. We'll explore how to use Optuna with RAPIDS in combination with Dask to run multi-GPU HPO experiments that can yield results faster than CPU."
   ]
  },
  {
   "cell_type": "code",
   "execution_count": 1,
   "metadata": {},
   "outputs": [],
   "source": [
    "## Run this cell to install optuna\n",
    "# !pip install optuna"
   ]
  },
  {
   "cell_type": "code",
   "execution_count": 2,
   "metadata": {},
   "outputs": [],
   "source": [
    "import cudf\n",
    "import cuml\n",
    "import dask_cudf\n",
    "import numpy as np\n",
    "import optuna\n",
    "import os\n",
    "import dask\n",
    "\n",
    "from cuml import LogisticRegression\n",
    "from cuml.model_selection import train_test_split\n",
    "from cuml.metrics import log_loss\n",
    "\n",
    "from dask_cuda import LocalCUDACluster\n",
    "from dask.distributed import Client, wait, performance_report"
   ]
  },
  {
   "cell_type": "markdown",
   "metadata": {},
   "source": [
    "## Set up CUDA Cluster\n",
    "\n",
    "We start a local cluster and keep it ready for running distributed tasks with dask. The dask scheduler can help leverage multiple nodes available on the cluster.\n",
    "\n",
    "[LocalCUDACluster](https://github.com/rapidsai/dask-cuda) launches one Dask worker for each GPU in the current systems. It's developed as a part of the RAPIDS project. Learn More:\n",
    "- [Setting up Dask](https://docs.dask.org/en/latest/setup.html)\n",
    "- [Dask Client](https://distributed.dask.org/en/latest/client.html)"
   ]
  },
  {
   "cell_type": "code",
   "execution_count": 3,
   "metadata": {},
   "outputs": [
    {
     "name": "stderr",
     "output_type": "stream",
     "text": [
      "2023-02-17 10:37:50,019 - distributed.preloading - INFO - Creating preload: dask_cuda.initialize\n",
      "2023-02-17 10:37:50,019 - distributed.preloading - INFO - Import preload module: dask_cuda.initialize\n",
      "2023-02-17 10:37:50,042 - distributed.preloading - INFO - Creating preload: dask_cuda.initialize\n",
      "2023-02-17 10:37:50,043 - distributed.preloading - INFO - Import preload module: dask_cuda.initialize\n",
      "2023-02-17 10:37:50,169 - distributed.preloading - INFO - Creating preload: dask_cuda.initialize\n",
      "2023-02-17 10:37:50,169 - distributed.preloading - INFO - Import preload module: dask_cuda.initialize\n",
      "2023-02-17 10:37:50,169 - distributed.preloading - INFO - Creating preload: dask_cuda.initialize\n",
      "2023-02-17 10:37:50,169 - distributed.preloading - INFO - Import preload module: dask_cuda.initialize\n"
     ]
    },
    {
     "data": {
      "text/html": [
       "<div>\n",
       "    <div style=\"width: 24px; height: 24px; background-color: #e1e1e1; border: 3px solid #9D9D9D; border-radius: 5px; position: absolute;\"> </div>\n",
       "    <div style=\"margin-left: 48px;\">\n",
       "        <h3 style=\"margin-bottom: 0px;\">Client</h3>\n",
       "        <p style=\"color: #9D9D9D; margin-bottom: 0px;\">Client-208a573f-aeaf-11ed-838c-98039b8174ae</p>\n",
       "        <table style=\"width: 100%; text-align: left;\">\n",
       "\n",
       "        <tr>\n",
       "        \n",
       "            <td style=\"text-align: left;\"><strong>Connection method:</strong> Cluster object</td>\n",
       "            <td style=\"text-align: left;\"><strong>Cluster type:</strong> dask_cuda.LocalCUDACluster</td>\n",
       "        \n",
       "        </tr>\n",
       "\n",
       "        \n",
       "            <tr>\n",
       "                <td style=\"text-align: left;\">\n",
       "                    <strong>Dashboard: </strong> <a href=\"http://10.136.7.105:8081/status\" target=\"_blank\">http://10.136.7.105:8081/status</a>\n",
       "                </td>\n",
       "                <td style=\"text-align: left;\"></td>\n",
       "            </tr>\n",
       "        \n",
       "\n",
       "        </table>\n",
       "\n",
       "        \n",
       "\n",
       "        \n",
       "            <details>\n",
       "            <summary style=\"margin-bottom: 20px;\"><h3 style=\"display: inline;\">Cluster Info</h3></summary>\n",
       "            <div class=\"jp-RenderedHTMLCommon jp-RenderedHTML jp-mod-trusted jp-OutputArea-output\">\n",
       "    <div style=\"width: 24px; height: 24px; background-color: #e1e1e1; border: 3px solid #9D9D9D; border-radius: 5px; position: absolute;\">\n",
       "    </div>\n",
       "    <div style=\"margin-left: 48px;\">\n",
       "        <h3 style=\"margin-bottom: 0px; margin-top: 0px;\">LocalCUDACluster</h3>\n",
       "        <p style=\"color: #9D9D9D; margin-bottom: 0px;\">3295963d</p>\n",
       "        <table style=\"width: 100%; text-align: left;\">\n",
       "            <tr>\n",
       "                <td style=\"text-align: left;\">\n",
       "                    <strong>Dashboard:</strong> <a href=\"http://10.136.7.105:8081/status\" target=\"_blank\">http://10.136.7.105:8081/status</a>\n",
       "                </td>\n",
       "                <td style=\"text-align: left;\">\n",
       "                    <strong>Workers:</strong> 4\n",
       "                </td>\n",
       "            </tr>\n",
       "            <tr>\n",
       "                <td style=\"text-align: left;\">\n",
       "                    <strong>Total threads:</strong> 4\n",
       "                </td>\n",
       "                <td style=\"text-align: left;\">\n",
       "                    <strong>Total memory:</strong> 376.54 GiB\n",
       "                </td>\n",
       "            </tr>\n",
       "            \n",
       "            <tr>\n",
       "    <td style=\"text-align: left;\"><strong>Status:</strong> running</td>\n",
       "    <td style=\"text-align: left;\"><strong>Using processes:</strong> True</td>\n",
       "</tr>\n",
       "\n",
       "            \n",
       "        </table>\n",
       "\n",
       "        <details>\n",
       "            <summary style=\"margin-bottom: 20px;\">\n",
       "                <h3 style=\"display: inline;\">Scheduler Info</h3>\n",
       "            </summary>\n",
       "\n",
       "            <div style=\"\">\n",
       "    <div>\n",
       "        <div style=\"width: 24px; height: 24px; background-color: #FFF7E5; border: 3px solid #FF6132; border-radius: 5px; position: absolute;\"> </div>\n",
       "        <div style=\"margin-left: 48px;\">\n",
       "            <h3 style=\"margin-bottom: 0px;\">Scheduler</h3>\n",
       "            <p style=\"color: #9D9D9D; margin-bottom: 0px;\">Scheduler-251b634e-1d2a-452c-82e6-ca8e9685c065</p>\n",
       "            <table style=\"width: 100%; text-align: left;\">\n",
       "                <tr>\n",
       "                    <td style=\"text-align: left;\">\n",
       "                        <strong>Comm:</strong> tcp://10.136.7.105:32955\n",
       "                    </td>\n",
       "                    <td style=\"text-align: left;\">\n",
       "                        <strong>Workers:</strong> 4\n",
       "                    </td>\n",
       "                </tr>\n",
       "                <tr>\n",
       "                    <td style=\"text-align: left;\">\n",
       "                        <strong>Dashboard:</strong> <a href=\"http://10.136.7.105:8081/status\" target=\"_blank\">http://10.136.7.105:8081/status</a>\n",
       "                    </td>\n",
       "                    <td style=\"text-align: left;\">\n",
       "                        <strong>Total threads:</strong> 4\n",
       "                    </td>\n",
       "                </tr>\n",
       "                <tr>\n",
       "                    <td style=\"text-align: left;\">\n",
       "                        <strong>Started:</strong> Just now\n",
       "                    </td>\n",
       "                    <td style=\"text-align: left;\">\n",
       "                        <strong>Total memory:</strong> 376.54 GiB\n",
       "                    </td>\n",
       "                </tr>\n",
       "            </table>\n",
       "        </div>\n",
       "    </div>\n",
       "\n",
       "    <details style=\"margin-left: 48px;\">\n",
       "        <summary style=\"margin-bottom: 20px;\">\n",
       "            <h3 style=\"display: inline;\">Workers</h3>\n",
       "        </summary>\n",
       "\n",
       "        \n",
       "        <div style=\"margin-bottom: 20px;\">\n",
       "            <div style=\"width: 24px; height: 24px; background-color: #DBF5FF; border: 3px solid #4CC9FF; border-radius: 5px; position: absolute;\"> </div>\n",
       "            <div style=\"margin-left: 48px;\">\n",
       "            <details>\n",
       "                <summary>\n",
       "                    <h4 style=\"margin-bottom: 0px; display: inline;\">Worker: 0</h4>\n",
       "                </summary>\n",
       "                <table style=\"width: 100%; text-align: left;\">\n",
       "                    <tr>\n",
       "                        <td style=\"text-align: left;\">\n",
       "                            <strong>Comm: </strong> tcp://10.136.7.105:43509\n",
       "                        </td>\n",
       "                        <td style=\"text-align: left;\">\n",
       "                            <strong>Total threads: </strong> 1\n",
       "                        </td>\n",
       "                    </tr>\n",
       "                    <tr>\n",
       "                        <td style=\"text-align: left;\">\n",
       "                            <strong>Dashboard: </strong> <a href=\"http://10.136.7.105:39899/status\" target=\"_blank\">http://10.136.7.105:39899/status</a>\n",
       "                        </td>\n",
       "                        <td style=\"text-align: left;\">\n",
       "                            <strong>Memory: </strong> 94.13 GiB\n",
       "                        </td>\n",
       "                    </tr>\n",
       "                    <tr>\n",
       "                        <td style=\"text-align: left;\">\n",
       "                            <strong>Nanny: </strong> tcp://10.136.7.105:39141\n",
       "                        </td>\n",
       "                        <td style=\"text-align: left;\"></td>\n",
       "                    </tr>\n",
       "                    <tr>\n",
       "                        <td colspan=\"2\" style=\"text-align: left;\">\n",
       "                            <strong>Local directory: </strong> /tmp/dask-worker-space/worker-x_wwwz34\n",
       "                        </td>\n",
       "                    </tr>\n",
       "\n",
       "                    \n",
       "                    <tr>\n",
       "                        <td style=\"text-align: left;\">\n",
       "                            <strong>GPU: </strong>Tesla T4\n",
       "                        </td>\n",
       "                        <td style=\"text-align: left;\">\n",
       "                            <strong>GPU memory: </strong> 14.76 GiB\n",
       "                        </td>\n",
       "                    </tr>\n",
       "                    \n",
       "\n",
       "                    \n",
       "\n",
       "                </table>\n",
       "            </details>\n",
       "            </div>\n",
       "        </div>\n",
       "        \n",
       "        <div style=\"margin-bottom: 20px;\">\n",
       "            <div style=\"width: 24px; height: 24px; background-color: #DBF5FF; border: 3px solid #4CC9FF; border-radius: 5px; position: absolute;\"> </div>\n",
       "            <div style=\"margin-left: 48px;\">\n",
       "            <details>\n",
       "                <summary>\n",
       "                    <h4 style=\"margin-bottom: 0px; display: inline;\">Worker: 1</h4>\n",
       "                </summary>\n",
       "                <table style=\"width: 100%; text-align: left;\">\n",
       "                    <tr>\n",
       "                        <td style=\"text-align: left;\">\n",
       "                            <strong>Comm: </strong> tcp://10.136.7.105:37595\n",
       "                        </td>\n",
       "                        <td style=\"text-align: left;\">\n",
       "                            <strong>Total threads: </strong> 1\n",
       "                        </td>\n",
       "                    </tr>\n",
       "                    <tr>\n",
       "                        <td style=\"text-align: left;\">\n",
       "                            <strong>Dashboard: </strong> <a href=\"http://10.136.7.105:32887/status\" target=\"_blank\">http://10.136.7.105:32887/status</a>\n",
       "                        </td>\n",
       "                        <td style=\"text-align: left;\">\n",
       "                            <strong>Memory: </strong> 94.13 GiB\n",
       "                        </td>\n",
       "                    </tr>\n",
       "                    <tr>\n",
       "                        <td style=\"text-align: left;\">\n",
       "                            <strong>Nanny: </strong> tcp://10.136.7.105:39781\n",
       "                        </td>\n",
       "                        <td style=\"text-align: left;\"></td>\n",
       "                    </tr>\n",
       "                    <tr>\n",
       "                        <td colspan=\"2\" style=\"text-align: left;\">\n",
       "                            <strong>Local directory: </strong> /tmp/dask-worker-space/worker-m8xv2btv\n",
       "                        </td>\n",
       "                    </tr>\n",
       "\n",
       "                    \n",
       "                    <tr>\n",
       "                        <td style=\"text-align: left;\">\n",
       "                            <strong>GPU: </strong>Tesla T4\n",
       "                        </td>\n",
       "                        <td style=\"text-align: left;\">\n",
       "                            <strong>GPU memory: </strong> 14.76 GiB\n",
       "                        </td>\n",
       "                    </tr>\n",
       "                    \n",
       "\n",
       "                    \n",
       "\n",
       "                </table>\n",
       "            </details>\n",
       "            </div>\n",
       "        </div>\n",
       "        \n",
       "        <div style=\"margin-bottom: 20px;\">\n",
       "            <div style=\"width: 24px; height: 24px; background-color: #DBF5FF; border: 3px solid #4CC9FF; border-radius: 5px; position: absolute;\"> </div>\n",
       "            <div style=\"margin-left: 48px;\">\n",
       "            <details>\n",
       "                <summary>\n",
       "                    <h4 style=\"margin-bottom: 0px; display: inline;\">Worker: 2</h4>\n",
       "                </summary>\n",
       "                <table style=\"width: 100%; text-align: left;\">\n",
       "                    <tr>\n",
       "                        <td style=\"text-align: left;\">\n",
       "                            <strong>Comm: </strong> tcp://10.136.7.105:36879\n",
       "                        </td>\n",
       "                        <td style=\"text-align: left;\">\n",
       "                            <strong>Total threads: </strong> 1\n",
       "                        </td>\n",
       "                    </tr>\n",
       "                    <tr>\n",
       "                        <td style=\"text-align: left;\">\n",
       "                            <strong>Dashboard: </strong> <a href=\"http://10.136.7.105:33629/status\" target=\"_blank\">http://10.136.7.105:33629/status</a>\n",
       "                        </td>\n",
       "                        <td style=\"text-align: left;\">\n",
       "                            <strong>Memory: </strong> 94.13 GiB\n",
       "                        </td>\n",
       "                    </tr>\n",
       "                    <tr>\n",
       "                        <td style=\"text-align: left;\">\n",
       "                            <strong>Nanny: </strong> tcp://10.136.7.105:44079\n",
       "                        </td>\n",
       "                        <td style=\"text-align: left;\"></td>\n",
       "                    </tr>\n",
       "                    <tr>\n",
       "                        <td colspan=\"2\" style=\"text-align: left;\">\n",
       "                            <strong>Local directory: </strong> /tmp/dask-worker-space/worker-h5js3ipb\n",
       "                        </td>\n",
       "                    </tr>\n",
       "\n",
       "                    \n",
       "                    <tr>\n",
       "                        <td style=\"text-align: left;\">\n",
       "                            <strong>GPU: </strong>Tesla T4\n",
       "                        </td>\n",
       "                        <td style=\"text-align: left;\">\n",
       "                            <strong>GPU memory: </strong> 14.76 GiB\n",
       "                        </td>\n",
       "                    </tr>\n",
       "                    \n",
       "\n",
       "                    \n",
       "\n",
       "                </table>\n",
       "            </details>\n",
       "            </div>\n",
       "        </div>\n",
       "        \n",
       "        <div style=\"margin-bottom: 20px;\">\n",
       "            <div style=\"width: 24px; height: 24px; background-color: #DBF5FF; border: 3px solid #4CC9FF; border-radius: 5px; position: absolute;\"> </div>\n",
       "            <div style=\"margin-left: 48px;\">\n",
       "            <details>\n",
       "                <summary>\n",
       "                    <h4 style=\"margin-bottom: 0px; display: inline;\">Worker: 3</h4>\n",
       "                </summary>\n",
       "                <table style=\"width: 100%; text-align: left;\">\n",
       "                    <tr>\n",
       "                        <td style=\"text-align: left;\">\n",
       "                            <strong>Comm: </strong> tcp://10.136.7.105:36985\n",
       "                        </td>\n",
       "                        <td style=\"text-align: left;\">\n",
       "                            <strong>Total threads: </strong> 1\n",
       "                        </td>\n",
       "                    </tr>\n",
       "                    <tr>\n",
       "                        <td style=\"text-align: left;\">\n",
       "                            <strong>Dashboard: </strong> <a href=\"http://10.136.7.105:45625/status\" target=\"_blank\">http://10.136.7.105:45625/status</a>\n",
       "                        </td>\n",
       "                        <td style=\"text-align: left;\">\n",
       "                            <strong>Memory: </strong> 94.13 GiB\n",
       "                        </td>\n",
       "                    </tr>\n",
       "                    <tr>\n",
       "                        <td style=\"text-align: left;\">\n",
       "                            <strong>Nanny: </strong> tcp://10.136.7.105:40643\n",
       "                        </td>\n",
       "                        <td style=\"text-align: left;\"></td>\n",
       "                    </tr>\n",
       "                    <tr>\n",
       "                        <td colspan=\"2\" style=\"text-align: left;\">\n",
       "                            <strong>Local directory: </strong> /tmp/dask-worker-space/worker-ql9e3i4f\n",
       "                        </td>\n",
       "                    </tr>\n",
       "\n",
       "                    \n",
       "                    <tr>\n",
       "                        <td style=\"text-align: left;\">\n",
       "                            <strong>GPU: </strong>Tesla T4\n",
       "                        </td>\n",
       "                        <td style=\"text-align: left;\">\n",
       "                            <strong>GPU memory: </strong> 14.76 GiB\n",
       "                        </td>\n",
       "                    </tr>\n",
       "                    \n",
       "\n",
       "                    \n",
       "\n",
       "                </table>\n",
       "            </details>\n",
       " 