      "\u001b[32m[I 2023-02-17 10:38:07,033]\u001b[0m Trial 0 finished with value: 8.247875378327683 and parameters: {'C': 40.573838784392514, 'penalty': 'l2', 'fit_intercept': True}. Best is trial 0 with value: 8.247875378327683.\u001b[0m\n",
      "\u001b[32m[I 2023-02-17 10:38:07,953]\u001b[0m Trial 3 finished with value: 8.221289538703516 and parameters: {'C': 12.183061292316713, 'penalty': 'l2', 'fit_intercept': True}. Best is trial 3 with value: 8.221289538703516.\u001b[0m\n",
      "\u001b[32m[I 2023-02-17 10:38:08,041]\u001b[0m Trial 2 finished with value: 8.253917695992195 and parameters: {'C': 40.573838784392514, 'penalty': 'l2', 'fit_intercept': True}. Best is trial 3 with value: 8.221289538703516.\u001b[0m\n",
      "\u001b[32m[I 2023-02-17 10:38:08,169]\u001b[0m Trial 1 finished with value: 8.228540336686851 and parameters: {'C': 40.573838784392514, 'penalty': 'l2', 'fit_intercept': True}. Best is trial 3 with value: 8.221289538703516.\u001b[0m\n",
      "\u001b[32m[I 2023-02-17 10:38:08,605]\u001b[0m Trial 6 finished with value: 8.250292310988796 and parameters: {'C': 12.183061292316713, 'penalty': 'l2', 'fit_intercept': True}. Best is trial 3 with value: 8.221289538703516.\u001b[0m\n",
      "\u001b[32m[I 2023-02-17 10:38:08,664]\u001b[0m Trial 5 finished with value: 8.241833396381626 and parameters: {'C': 0.028870434982716877, 'penalty': 'l2', 'fit_intercept': True}. Best is trial 3 with value: 8.221289538703516.\u001b[0m\n",
      "\u001b[32m[I 2023-02-17 10:38:09,044]\u001b[0m Trial 4 finished with value: 8.245458781385024 and parameters: {'C': 40.573838784392514, 'penalty': 'l2', 'fit_intercept': True}. Best is trial 3 with value: 8.221289538703516.\u001b[0m\n",
      "\u001b[32m[I 2023-02-17 10:38:09,099]\u001b[0m Trial 8 finished with value: 8.25029236694187 and parameters: {'C': 0.028870434982716877, 'penalty': 'l2', 'fit_intercept': True}. Best is trial 3 with value: 8.221289538703516.\u001b[0m\n",
      "\u001b[32m[I 2023-02-17 10:38:09,251]\u001b[0m Trial 9 finished with value: 8.247875294398069 and parameters: {'C': 67.82426496348721, 'penalty': 'l2', 'fit_intercept': True}. Best is trial 3 with value: 8.221289538703516.\u001b[0m\n",
      "\u001b[32m[I 2023-02-17 10:38:09,455]\u001b[0m Trial 11 finished with value: 8.251500763331082 and parameters: {'C': 67.82426496348721, 'penalty': 'l2', 'fit_intercept': True}. Best is trial 3 with value: 8.221289538703516.\u001b[0m\n",
      "\u001b[32m[I 2023-02-17 10:38:09,566]\u001b[0m Trial 12 finished with value: 8.24304134514623 and parameters: {'C': 6.682974952480256, 'penalty': 'l2', 'fit_intercept': False}. Best is trial 3 with value: 8.221289538703516.\u001b[0m\n",
      "\u001b[32m[I 2023-02-17 10:38:09,619]\u001b[0m Trial 7 finished with value: 8.21403885262633 and parameters: {'C': 12.183061292316713, 'penalty': 'l2', 'fit_intercept': True}. Best is trial 7 with value: 8.21403885262633.\u001b[0m\n",
      "\u001b[32m[I 2023-02-17 10:38:09,722]\u001b[0m Trial 10 finished with value: 8.25029236694187 and parameters: {'C': 12.183061292316713, 'penalty': 'l2', 'fit_intercept': True}. Best is trial 7 with value: 8.21403885262633.\u001b[0m\n",
      "\u001b[32m[I 2023-02-17 10:38:09,818]\u001b[0m Trial 13 finished with value: 8.253917612062581 and parameters: {'C': 2.0030868464433764, 'penalty': 'none', 'fit_intercept': False}. Best is trial 7 with value: 8.21403885262633.\u001b[0m\n",
      "\u001b[32m[I 2023-02-17 10:38:09,872]\u001b[0m Trial 14 finished with value: 8.251500679401468 and parameters: {'C': 2.0030868464433764, 'penalty': 'none', 'fit_intercept': False}. Best is trial 7 with value: 8.21403885262633.\u001b[0m\n",
      "\u001b[32m[I 2023-02-17 10:38:10,092]\u001b[0m Trial 16 finished with value: 8.24787526642153 and parameters: {'C': 2.0030868464433764, 'penalty': 'none', 'fit_intercept': False}. Best is trial 7 with value: 8.21403885262633.\u001b[0m\n",
      "\u001b[32m[I 2023-02-17 10:38:10,099]\u001b[0m Trial 15 finished with value: 8.252709243649907 and parameters: {'C': 2.0030868464433764, 'penalty': 'none', 'fit_intercept': False}. Best is trial 7 with value: 8.21403885262633.\u001b[0m\n",
      "\u001b[32m[I 2023-02-17 10:38:10,557]\u001b[0m Trial 17 finished with value: 8.249084278294575 and parameters: {'C': 0.9459046834713561, 'penalty': 'l1', 'fit_intercept': False}. Best is trial 7 with value: 8.21403885262633.\u001b[0m\n",
      "\u001b[32m[I 2023-02-17 10:38:10,581]\u001b[0m Trial 18 finished with value: 8.247875769999213 and parameters: {'C': 0.4428829638044645, 'penalty': 'l1', 'fit_intercept': False}. Best is trial 7 with value: 8.21403885262633.\u001b[0m\n",
      "\u001b[32m[I 2023-02-17 10:38:11,477]\u001b[0m Trial 19 finished with value: 8.21524817224129 and parameters: {'C': 0.34118772696334027, 'penalty': 'l1', 'fit_intercept': True}. Best is trial 7 with value: 8.21403885262633.\u001b[0m\n",
      "\u001b[32m[I 2023-02-17 10:38:11,684]\u001b[0m Trial 20 finished with value: 8.214039719899006 and parameters: {'C': 0.34118772696334027, 'penalty': 'l1', 'fit_intercept': True}. Best is trial 7 with value: 8.21403885262633.\u001b[0m\n",
      "\u001b[32m[I 2023-02-17 10:38:12,541]\u001b[0m Trial 22 finished with value: 8.215248116288217 and parameters: {'C': 7.20323151375873, 'penalty': 'l1', 'fit_intercept': True}. Best is trial 7 with value: 8.21403885262633.\u001b[0m\n",
      "\u001b[32m[I 2023-02-17 10:38:12,603]\u001b[0m Trial 21 finished with value: 8.21524817224129 and parameters: {'C': 7.20323151375873, 'penalty': 'l1', 'fit_intercept': True}. Best is trial 7 with value: 8.21403885262633.\u001b[0m\n",
      "\u001b[32m[I 2023-02-17 10:38:12,780]\u001b[0m Trial 23 finished with value: 8.214039775852083 and parameters: {'C': 0.15587899286863757, 'penalty': 'l1', 'fit_intercept': True}. Best is trial 7 with value: 8.21403885262633.\u001b[0m\n",
      "\u001b[32m[I 2023-02-17 10:38:13,189]\u001b[0m Trial 24 finished with value: 8.214039775852083 and parameters: {'C': 0.15587899286863757, 'penalty': 'l1', 'fit_intercept': True}. Best is trial 7 with value: 8.21403885262633.\u001b[0m\n",
      "\u001b[32m[I 2023-02-17 10:38:13,946]\u001b[0m Trial 25 finished with value: 8.220082205422743 and parameters: {'C': 0.13331995152410292, 'penalty': 'l1', 'fit_intercept': True}. Best is trial 7 with value: 8.21403885262633.\u001b[0m\n",
      "\u001b[32m[I 2023-02-17 10:38:14,425]\u001b[0m Trial 26 finished with value: 8.218873697127382 and parameters: {'C': 0.13331995152410292, 'penalty': 'l1', 'fit_intercept': True}. Best is trial 7 with value: 8.21403885262633.\u001b[0m\n",
      "\u001b[32m[I 2023-02-17 10:38:14,506]\u001b[0m Trial 27 finished with value: 8.211622731284818 and parameters: {'C': 0.13317405504008187, 'penalty': 'l1', 'fit_intercept': True}. Best is trial 27 with value: 8.211622731284818.\u001b[0m\n",
      "\u001b[32m[I 2023-02-17 10:38:14,754]\u001b[0m Trial 28 finished with value: 8.218873753080457 and parameters: {'C': 0.09161974779967816, 'penalty': 'l1', 'fit_intercept': True}. Best is trial 27 with value: 8.211622731284818.\u001b[0m\n",
      "\u001b[32m[I 2023-02-17 10:38:14,932]\u001b[0m Trial 30 finished with value: 8.217665356691247 and parameters: {'C': 0.01161870199450424, 'penalty': 'l1', 'fit_intercept': True}. Best is trial 27 with value: 8.211622731284818.\u001b[0m\n",
      "\u001b[32m[I 2023-02-17 10:38:15,511]\u001b[0m Trial 29 finished with value: 8.218873781056995 and parameters: {'C': 0.0834294717814003, 'penalty': 'l1', 'fit_intercept': True}. Best is trial 27 with value: 8.211622731284818.\u001b[0m\n",
      "\u001b[32m[I 2023-02-17 10:38:15,538]\u001b[0m Trial 31 finished with value: 8.217665496573938 and parameters: {'C': 0.01161870199450424, 'penalty': 'l1', 'fit_intercept': True}. Best is trial 27 with value: 8.211622731284818.\u001b[0m\n",
      "\u001b[32m[I 2023-02-17 10:38:15,802]\u001b[0m Trial 32 finished with value: 8.21645704423165 and parameters: {'C': 0.01161870199450424, 'penalty': 'l1', 'fit_intercept': True}. Best is trial 27 with value: 8.211622731284818.\u001b[0m\n",
      "\u001b[32m[I 2023-02-17 10:38:16,028]\u001b[0m Trial 33 finished with value: 8.210414362872145 and parameters: {'C': 0.5889161850687648, 'penalty': 'l1', 'fit_intercept': True}. Best is trial 33 with value: 8.210414362872145.\u001b[0m\n",
      "\u001b[32m[I 2023-02-17 10:38:16,593]\u001b[0m Trial 34 finished with value: 8.211622787237895 and parameters: {'C': 0.29039065153275884, 'penalty': 'l1', 'fit_intercept': True}. Best is trial 33 with value: 8.210414362872145.\u001b[0m\n",
      "\u001b[32m[I 2023-02-17 10:38:17,556]\u001b[0m Trial 36 finished with value: 8.214039635969392 and parameters: {'C': 0.29039065153275884, 'penalty': 'l1', 'fit_intercept': True}. Best is trial 33 with value: 8.210414362872145.\u001b[0m\n",
      "\u001b[32m[I 2023-02-17 10:38:17,762]\u001b[0m Trial 38 finished with value: 8.214039747875544 and parameters: {'C': 0.6356655062780381, 'penalty': 'l1', 'fit_intercept': True}. Best is trial 33 with value: 8.210414362872145.\u001b[0m\n",
      "\u001b[32m[I 2023-02-17 10:38:17,906]\u001b[0m Trial 37 finished with value: 8.214039719899006 and parameters: {'C': 0.40506074358435035, 'penalty': 'l1', 'fit_intercept': True}. Best is trial 33 with value: 8.210414362872145.\u001b[0m\n",
      "\u001b[32m[I 2023-02-17 10:38:17,938]\u001b[0m Trial 35 finished with value: 8.215248200217829 and parameters: {'C': 0.29039065153275884, 'penalty': 'l1', 'fit_intercept': True}. Best is trial 33 with value: 8.210414362872145.\u001b[0m\n",
      "\u001b[32m[I 2023-02-17 10:38:18,033]\u001b[0m Trial 39 finished with value: 8.247875574163448 and parameters: {'C': 0.7211398436523727, 'penalty': 'none', 'fit_intercept': True}. Best is trial 33 with value: 8.210414362872145.\u001b[0m\n",
      "\u001b[32m[I 2023-02-17 10:38:18,215]\u001b[0m Trial 40 finished with value: 8.250292338965332 and parameters: {'C': 0.8988603430698667, 'penalty': 'none', 'fit_intercept': True}. Best is trial 33 with value: 8.210414362872145.\u001b[0m\n",
      "\u001b[32m[I 2023-02-17 10:38:18,357]\u001b[0m Trial 42 finished with value: 8.252709215673368 and parameters: {'C': 0.8562976914659627, 'penalty': 'l2', 'fit_intercept': True}. Best is trial 33 with value: 8.210414362872145.\u001b[0m\n",
      "\u001b[32m[I 2023-02-17 10:38:18,521]\u001b[0m Trial 43 finished with value: 8.246667177774237 and parameters: {'C': 1.1735421529699095, 'penalty': 'l2', 'fit_intercept': True}. Best is trial 33 with value: 8.210414362872145.\u001b[0m\n",
      "\u001b[32m[I 2023-02-17 10:38:18,759]\u001b[0m Trial 41 finished with value: 8.203162697616131 and parameters: {'C': 1.0180328243030141, 'penalty': 'l2', 'fit_intercept': True}. Best is trial 41 with value: 8.203162697616131.\u001b[0m\n",
      "\u001b[32m[I 2023-02-17 10:38:18,875]\u001b[0m Trial 45 finished with value: 8.249083998529198 and parameters: {'C': 1.470107035818969, 'penalty': 'l2', 'fit_intercept': True}. Best is trial 41 with value: 8.203162697616131.\u001b[0m\n",
      "\u001b[32m[I 2023-02-17 10:38:19,078]\u001b[0m Trial 44 finished with value: 8.209204903374491 and parameters: {'C': 1.215885094202452, 'penalty': 'l2', 'fit_intercept': True}. Best is trial 41 with value: 8.203162697616131.\u001b[0m\n",
      "\u001b[32m[I 2023-02-17 10:38:19,122]\u001b[0m Trial 47 finished with value: 8.244249853441593 and parameters: {'C': 3.1251012068006196, 'penalty': 'l2', 'fit_intercept': True}. Best is trial 41 with value: 8.203162697616131.\u001b[0m\n",
      "\u001b[32m[I 2023-02-17 10:38:19,212]\u001b[0m Trial 48 finished with value: 8.241832892803943 and parameters: {'C': 3.1251012068006196, 'penalty': 'l2', 'fit_intercept': True}. Best is trial 41 with value: 8.203162697616131.\u001b[0m\n",
      "\u001b[32m[I 2023-02-17 10:38:19,607]\u001b[0m Trial 49 finished with value: 8.249083802693432 and parameters: {'C': 0.5247083049626469, 'penalty': 'l2', 'fit_intercept': True}. Best is trial 41 with value: 8.203162697616131.\u001b[0m\n",
      "\u001b[32m[I 2023-02-17 10:38:19,787]\u001b[0m Trial 51 finished with value: 8.250292283012255 and parameters: {'C': 0.594672049508206, 'penalty': 'l2', 'fit_intercept': True}. Best is trial 41 with value: 8.203162697616131.\u001b[0m\n",
      "\u001b[32m[I 2023-02-17 10:38:19,883]\u001b[0m Trial 50 finished with value: 8.215246941273623 and parameters: {'C': 0.594672049508206, 'penalty': 'l2', 'fit_intercept': True}. Best is trial 41 with value: 8.203162697616131.\u001b[0m\n",
      "\u001b[32m[I 2023-02-17 10:38:19,924]\u001b[0m Trial 52 finished with value: 8.245458417690031 and parameters: {'C': 0.6982022429771052, 'penalty': 'l2', 'fit_intercept': True}. Best is trial 41 with value: 8.203162697616131.\u001b[0m\n",
      "\u001b[32m[I 2023-02-17 10:38:20,141]\u001b[0m Trial 53 finished with value: 8.247875322374606 and parameters: {'C': 0.6982022429771052, 'penalty': 'l2', 'fit_intercept': False}. Best is trial 41 with value: 8.203162697616131.\u001b[0m\n",
      "\u001b[32m[I 2023-02-17 10:38:20,364]\u001b[0m Trial 55 finished with value: 8.252709187696832 and parameters: {'C': 23.88860256720992, 'penalty': 'l2', 'fit_intercept': False}. Best is trial 41 with value: 8.203162697616131.\u001b[0m\n",
      "\u001b[32m[I 2023-02-17 10:38:20,631]\u001b[0m Trial 46 finished with value: 8.220082093516593 and parameters: {'C': 0.18943289702535804, 'penalty': 'l1', 'fit_intercept': True}. Best is trial 41 with value: 8.203162697616131.\u001b[0m\n",
      "\u001b[32m[I 2023-02-17 10:38:20,707]\u001b[0m Trial 56 finished with value: 8.243041568958532 and parameters: {'C': 23.88860256720992, 'penalty': 'l2', 'fit_intercept': True}. Best is trial 41 with value: 8.203162697616131.\u001b[0m\n",
      "\u001b[32m[I 2023-02-17 10:38:21,054]\u001b[0m Trial 59 finished with value: 8.249083886623046 and parameters: {'C': 0.2304567118696556, 'penalty': 'l2', 'fit_intercept': True}. Best is trial 41 with value: 8.203162697616131.\u001b[0m\n",
      "\u001b[32m[I 2023-02-17 10:38:21,190]\u001b[0m Trial 54 finished with value: 8.217664153700117 and parameters: {'C': 28.94484897140112, 'penalty': 'l2', 'fit_intercept': True}. Best is trial 41 with value: 8.203162697616131.\u001b[0m\n",
      "\u001b[32m[I 2023-02-17 10:38:21,320]\u001b[0m Trial 57 finished with value: 8.209205099210257 and parameters: {'C': 0.2304567118696556, 'penalty': 'l2', 'fit_intercept': True}. Best is trial 41 with value: 8.203162697616131.\u001b[0m\n",
      "\u001b[32m[I 2023-02-17 10:38:21,667]\u001b[0m Trial 61 finished with value: 8.247875602139985 and parameters: {'C': 1.3083983229057563, 'penalty': 'none', 'fit_intercept': True}. Best is trial 41 with value: 8.203162697616131.\u001b[0m\n",
      "\u001b[32m[I 2023-02-17 10:38:21,697]\u001b[0m Trial 60 finished with value: 8.217664041793965 and parameters: {'C': 1.3350093383986137, 'penalty': 'l2', 'fit_intercept': True}. Best is trial 41 with value: 8.203162697616131.\u001b[0m\n",
      "\u001b[32m[I 2023-02-17 10:38:22,213]\u001b[0m Trial 64 finished with value: 8.25150079130762 and parameters: {'C': 0.44802419204313526, 'penalty': 'l2', 'fit_intercept': True}. Best is trial 41 with value: 8.203162697616131.\u001b[0m\n",
      "\u001b[32m[I 2023-02-17 10:38:22,283]\u001b[0m Trial 62 finished with value: 8.198328832293907 and parameters: {'C': 0.46570264632805103, 'penalty': 'none', 'fit_intercept': True}. Best is trial 62 with value: 8.198328832293907.\u001b[0m\n",
      "\u001b[32m[I 2023-02-17 10:38:22,632]\u001b[0m Trial 65 finished with value: 8.24908397055266 and parameters: {'C': 0.24456030311795268, 'penalty': 'l2', 'fit_intercept': True}. Best is trial 62 with value: 8.198328832293907.\u001b[0m\n",
      "\u001b[32m[I 2023-02-17 10:38:22,636]\u001b[0m Trial 58 finished with value: 8.205579714206857 and parameters: {'C': 0.22786149466321445, 'penalty': 'l2', 'fit_intercept': True}. Best is trial 62 with value: 8.198328832293907.\u001b[0m\n",
      "\u001b[32m[I 2023-02-17 10:38:22,719]\u001b[0m Trial 66 finished with value: 8.245458277807343 and parameters: {'C': 0.2562139315011522, 'penalty': 'none', 'fit_intercept': True}. Best is trial 62 with value: 8.198328832293907.\u001b[0m\n",
      "\u001b[32m[I 2023-02-17 10:38:22,864]\u001b[0m Trial 63 finished with value: 8.210413383693316 and parameters: {'C': 0.42963908148132157, 'penalty': 'l2', 'fit_intercept': True}. Best is trial 62 with value: 8.198328832293907.\u001b[0m\n",
      "\u001b[32m[I 2023-02-17 10:38:23,059]\u001b[0m Trial 68 finished with value: 8.255126148334481 and parameters: {'C': 0.4325592525072435, 'penalty': 'none', 'fit_intercept': False}. Best is trial 62 with value: 8.198328832293907.\u001b[0m\n",
      "\u001b[32m[I 2023-02-17 10:38:23,092]\u001b[0m Trial 67 finished with value: 8.251500763331082 and parameters: {'C': 0.400363407043762, 'penalty': 'none', 'fit_intercept': False}. Best is trial 62 with value: 8.198328832293907.\u001b[0m\n",
      "\u001b[32m[I 2023-02-17 10:38:23,111]\u001b[0m Trial 69 finished with value: 8.250292283012257 and parameters: {'C': 0.45811082432017874, 'penalty': 'none', 'fit_intercept': False}. Best is trial 62 with value: 8.198328832293907.\u001b[0m\n",
      "\u001b[32m[I 2023-02-17 10:38:23,202]\u001b[0m Trial 70 finished with value: 8.252709215673368 and parameters: {'C': 0.3366950282604448, 'penalty': 'none', 'fit_intercept': False}. Best is trial 62 with value: 8.198328832293907.\u001b[0m\n",
      "\u001b[32m[I 2023-02-17 10:38:23,447]\u001b[0m Trial 73 finished with value: 8.24666687003232 and parameters: {'C': 1.001276433559266, 'penalty': 'l2', 'fit_intercept': True}. Best is trial 62 with value: 8.198328832293907.\u001b[0m\n",
      "\u001b[32m[I 2023-02-17 10:38:23,497]\u001b[0m Trial 72 finished with value: 8.249083830669969 and parameters: {'C': 0.9465587879326931, 'penalty': 'l2', 'fit_intercept': True}. Best is trial 62 with value: 8.198328832293907.\u001b[0m\n",
      "\u001b[32m[I 2023-02-17 10:38:23,539]\u001b[0m Trial 74 finished with value: 8.244249881418131 and parameters: {'C': 0.17498501865193736, 'penalty': 'l2', 'fit_intercept': True}. Best is trial 62 with value: 8.198328832293907.\u001b[0m\n",
      "\u001b[32m[I 2023-02-17 10:38:23,762]\u001b[0m Trial 75 finished with value: 8.234582010890993 and parameters: {'C': 0.09676716520222205, 'penalty': 'l2', 'fit_intercept': True}. Best is trial 62 with value: 8.198328832293907.\u001b[0m\n",
      "\u001b[32m[I 2023-02-17 10:38:23,875]\u001b[0m Trial 76 finished with value: 8.251500875237234 and parameters: {'C': 0.11796046210672348, 'penalty': 'l2', 'fit_intercept': True}. Best is trial 62 with value: 8.198328832293907.\u001b[0m\n",
      "\u001b[32m[I 2023-02-17 10:38:23,882]\u001b[0m Trial 71 finished with value: 8.252709243649907 and parameters: {'C': 0.35804471299010093, 'penalty': 'l2', 'fit_intercept': True}. Best is trial 62 with value: 8.198328832293907.\u001b[0m\n",
      "\u001b[32m[I 2023-02-17 10:38:24,158]\u001b[0m Trial 78 finished with value: 8.247875602139986 and parameters: {'C': 0.5360163523983655, 'penalty': 'l2', 'fit_intercept': True}. Best is trial 62 with value: 8.198328832293907.\u001b[0m\n",
      "\u001b[32m[I 2023-02-17 10:38:24,554]\u001b[0m Trial 77 finished with value: 8.214038628814027 and parameters: {'C': 0.11385001891151933, 'penalty': 'l2', 'fit_intercept': True}. Best is trial 62 with value: 8.198328832293907.\u001b[0m\n",
      "\u001b[32m[I 2023-02-17 10:38:24,605]\u001b[0m Trial 81 finished with value: 8.252709383532595 and parameters: {'C': 0.19199360495534568, 'penalty': 'l2', 'fit_intercept': True}. Best is trial 62 with value: 8.198328832293907.\u001b[0m\n",
      "\u001b[32m[I 2023-02-17 10:38:24,616]\u001b[0m Trial 80 finished with value: 8.247875378327683 and parameters: {'C': 0.2180889828523076, 'penalty': 'l2', 'fit_intercept': True}. Best is trial 62 with value: 8.198328832293907.\u001b[0m\n",
      "\u001b[32m[I 2023-02-17 10:38:25,238]\u001b[0m Trial 79 finished with value: 8.215247640687073 and parameters: {'C': 0.19199360495534568, 'penalty': 'l2', 'fit_intercept': True}. Best is trial 62 with value: 8.198328832293907.\u001b[0m\n",
      "\u001b[32m[I 2023-02-17 10:38:25,394]\u001b[0m Trial 82 finished with value: 8.222498746412327 and parameters: {'C': 0.20307546518876748, 'penalty': 'l1', 'fit_intercept': True}. Best is trial 62 with value: 8.198328832293907.\u001b[0m\n",
      "\u001b[32m[I 2023-02-17 10:38:26,112]\u001b[0m Trial 84 finished with value: 8.206788865962592 and parameters: {'C': 0.32564474352266887, 'penalty': 'l1', 'fit_intercept': True}. Best is trial 62 with value: 8.198328832293907.\u001b[0m\n",
      "\u001b[32m[I 2023-02-17 10:38:26,431]\u001b[0m Trial 83 finished with value: 8.215248116288217 and parameters: {'C': 0.2765570042119916, 'penalty': 'l1', 'fit_intercept': True}. Best is trial 62 with value: 8.198328832293907.\u001b[0m\n",
      "\u001b[32m[I 2023-02-17 10:38:26,634]\u001b[0m Trial 85 finished with value: 8.215248200217832 and parameters: {'C': 0.3226259801946211, 'penalty': 'l1', 'fit_intercept': True}. Best is trial 62 with value: 8.198328832293907.\u001b[0m\n",
      "\u001b[32m[I 2023-02-17 10:38:26,877]\u001b[0m Trial 86 finished with value: 8.214039719899006 and parameters: {'C': 0.2819874675157722, 'penalty': 'l1', 'fit_intercept': True}. Best is trial 62 with value: 8.198328832293907.\u001b[0m\n",
      "\u001b[32m[I 2023-02-17 10:38:27,817]\u001b[0m Trial 88 finished with value: 8.214039775852081 and parameters: {'C': 0.31458836735455475, 'penalty': 'l1', 'fit_intercept': True}. Best is trial 62 with value: 8.198328832293907.\u001b[0m\n",
      "\u001b[32m[I 2023-02-17 10:38:27,949]\u001b[0m Trial 87 finished with value: 8.217665104902405 and parameters: {'C': 0.3065189818970442, 'penalty': 'l1', 'fit_intercept': True}. Best is trial 62 with value: 8.198328832293907.\u001b[0m\n",
